{
    "$schema":  "../../tools/vergil-ver2-argb-recolor.config.schema.json",
    "schemaVersion":  1,
    "themeId":  "weaponmaster-vergil-dark-blue",
    "sourceNpk":  {
                      "path":  "G:/Program Files (x86)/WeGameApps/地下城与勇士：创新世纪/ImagePacks2/sprite_character_swordman_effect_flowmindadvanced.NPK",
                      "sha256":  "2EFAD9E5D41BB526DF2AF86FC332DB7963ECCDFCB8EBAFAD9C7E4F1E00E387CC",
                      "length":  2613807
                  },
    "output":  {
                   "componentNpkPath":  "../../npk/full-skill-v1/components/weaponmaster-vergil-dark-blue-flowmindadvanced-ver2-v1.NPK",
                   "buildSummaryPath":  "../../validation/full-skill-v1/components/flowmindadvanced-ver2/build-summary.json"
               },
    "expectations":  {
                         "albumCount":  7,
                         "frameCount":  42
                     },
    "allowedImgPaths":  [
                            "sprite/character/swordman/effect/flowmindadvanced/beamswordthreeslashn.img",
                            "sprite/character/swordman/effect/flowmindadvanced/longswordonefallbodyn.img",
                            "sprite/character/swordman/effect/flowmindadvanced/macebackhitlexport.img",
                            "sprite/character/swordman/effect/flowmindadvanced/macegroundcrackn.img",
                            "sprite/character/swordman/effect/flowmindadvanced/macehitn.img",
                            "sprite/character/swordman/effect/flowmindadvanced/shortswordonefalladdslashm.img",
                            "sprite/character/swordman/effect/flowmindadvanced/weaponfadernd.img"
                        ],
    "excludedImgPaths":  [
                              "sprite/character/swordman/effect/flowmindadvanced/longswordonebodytornatoan.img"
                          ],
    "excludedFrameKeys":  [
                          ]
}
